{
  "format": "soc-game-package",
  "version": 1,
  "app": "portable",
  "segments": [
    {
      "file": "mario-castle-sdram-direct-packed-mul-geometry-uncapped-test.bin",
      "address": 0,
      "bytes": 27104,
      "sha256": "e080ccf836d6d9fc4dd246dae82d49741784f3b7ed0e7d43c62897380a3bce45"
    },
    {
      "file": "mario-castle-sdram-direct-packed-mul-geometry-uncapped-test.assets.bin",
      "address": 2147483648,
      "bytes": 883124,
      "sha256": "afa690e2965016a9ce5cec307a34942856f6b573a551a5761e9f5738dd1f4cc6"
    }
  ],
  "required_cpu_features": {
    "mul": true,
    "mmio_feature_bit": 0,
    "geometry-worker-v1": true
  },
  "content": {
    "format": "soc-game-assets",
    "version": 1,
    "runtime_abi": 1,
    "game": "mario-castle",
    "units": "gpu-q8.8",
    "material_policy": "indexed-flat-rgb",
    "palette_colors": 101,
    "meshes": [
      {
        "vertices": 128,
        "triangles": 200
      },
      {
        "vertices": 8,
        "triangles": 12
      }
    ],
    "collision": {
      "abi": "triangle-q12-normal-v1",
      "floors": 2816,
      "walls": 4747
    },
    "animation": {
      "abi": "none",
      "clips": []
    },
    "configuration": {
      "module": "world",
      "physics": {},
      "camera": {
        "focal": 256,
        "near_z": 257
      },
      "spawn": [
        0,
        0,
        0
      ],
      "game": {
        "port": "custom",
        "implementation_status": "castle-traversal-foundation; mission incomplete"
      },
      "world": {
        "abi": "sdram-areas-v1",
        "areas": 5,
        "stored_chunks": 72,
        "render_scale": 4,
        "near_gpu": 257,
        "far_gpu": 30000,
        "focal_gpu": 256,
        "resident_handles": 2,
        "cache_policy": "uploads-between-frames; uncached-visible-triangles-software-clipped"
      }
    },
    "source": {
      "profile": "game.project.json",
      "sha256": "43c70457b2738e2366f4e0e8889f4980c7d4e93f5d3777f207eabc9f46e0b2e4"
    }
  },
  "target": {
    "id": "de2-115-fixed-v2",
    "runtime_abi": 1,
    "required_features": [
      "indexed-flat-rgb",
      "triangle-collision",
      "custom-rv32i-gameplay",
      "mouse-look-v1"
    ]
  },
  "required_gpu_features": {
    "packed-enqueue-v1": true
  },
  "diagnostic": {
    "terrain_submission": "CPU-clipped direct triangles; GPU resident terrain cache bypassed",
    "purpose": "isolate terrain mesh uploads and cached-versus-direct clipping; not a performance optimization"
  },
  "cadence": {
    "simulation_tick_cycles": 1666667,
    "clock_hz": 50000000,
    "render": "uncapped",
    "render_repeat_safe": true
  }
}
