{
  "format": "soc-game-package",
  "version": 1,
  "app": "portable",
  "segments": [
    {
      "file": "mario-castle-audit-fixed-sdram-direct-packed-mul-geometry-uncapped-interpolated.bin",
      "address": 0,
      "bytes": 29176,
      "sha256": "1ddf2d255c690c5094356969a173e22d1e3f347ec75ef85a7dd370834cbf7ca1"
    },
    {
      "file": "mario-castle-audit-fixed-sdram-direct-packed-mul-geometry-uncapped-interpolated.assets.bin",
      "address": 2147483648,
      "bytes": 883160,
      "sha256": "65413afb4c49b42581291d48547d58407cd118678d02bca0bb1869f790b226d4"
    }
  ],
  "required_cpu_features": {
    "mul": true,
    "mmio_feature_bit": 0,
    "geometry-worker-v1": true
  },
  "content": {
    "format": "soc-game-assets",
    "version": 1,
    "runtime_abi": 1,
    "game": "mario-castle-audit-fixed",
    "units": "gpu-q8.8",
    "material_policy": "indexed-flat-rgb",
    "palette_colors": 146,
    "meshes": [
      {
        "vertices": 128,
        "triangles": 200
      },
      {
        "vertices": 8,
        "triangles": 12
      }
    ],
    "collision": {
      "abi": "triangle-q12-normal-v1",
      "floors": 2816,
      "walls": 4747
    },
    "animation": {
      "abi": "none",
      "clips": []
    },
    "configuration": {
      "module": "world",
      "physics": {},
      "camera": {
        "focal": 256,
        "near_z": 257
      },
      "spawn": [
        0,
        0,
        0
      ],
      "game": {
        "port": "custom",
        "implementation_status": "castle-traversal-foundation; mission incomplete"
      },
      "world": {
        "abi": "sdram-areas-v1",
        "areas": 5,
        "stored_chunks": 83,
        "render_scale": 4,
        "near_gpu": 257,
        "far_gpu": 30000,
        "focal_gpu": 256,
        "resident_handles": 2,
        "cache_policy": "uploads-between-frames; uncached-visible-triangles-software-clipped"
      }
    },
    "source": {
      "profile": "audit-fixed.project.json",
      "sha256": "aba1bc20a16c382370d6a006dd782bc148c563692fe584dfbbdc2be188b0fce4"
    }
  },
  "target": {
    "id": "de2-115-fixed-v2",
    "runtime_abi": 1,
    "required_features": [
      "indexed-flat-rgb",
      "triangle-collision",
      "custom-rv32i-gameplay",
      "mouse-look-v1"
    ]
  },
  "required_gpu_features": {
    "packed-enqueue-v1": true
  },
  "diagnostic": {
    "terrain_submission": "CPU-clipped direct triangles; GPU resident terrain cache bypassed",
    "purpose": "isolate terrain mesh uploads and cached-versus-direct clipping; not a performance optimization"
  },
  "cadence": {
    "simulation_tick_cycles": 1666667,
    "clock_hz": 50000000,
    "render": "uncapped",
    "render_repeat_safe": true,
    "interpolation": true
  }
}
